{
  "schema_version": "1.0.0",
  "registry_id": "ahangban-visual-assets",
  "generated_on": "2026-10-18",
  "source_of_truth": "assets.json",
  "records": [
    {
      "path": "assets/ahangban-logo-horizontal-color.png",
      "file_name": "ahangban-logo-horizontal-color.png",
      "category": "asset",
      "format": "png",
      "purpose": "لوگو، نشان یا آیکن رابط؛ نسخهٔ دقیق را از نام فایل بخوانید.",
      "dimensions": [
        1200,
        369
      ],
      "bytes": 21389,
      "approval_status": "WORKING_DRAFT",
      "license_status": "UNKNOWN",
      "source": "مخزن git آهنگ‌بان؛ منشأ بیرونی/مالکیت جداگانه مستند نشده است.",
      "last_changed_on": null,
      "notes": "تاریخ تغییر از metadata فایل ثبت نشده؛ نسخهٔ موجود را حذف یا جایگزین نکنید.",
      "aspect_ratio": "400:123"
    },
    {
      "path": "assets/ahangban-logo-horizontal-color.svg",
      "file_name": "ahangban-logo-horizontal-color.svg",
      "category": "asset",
      "format": "svg",
      "purpose": "لوگو، نشان یا آیکن رابط؛ نسخهٔ دقیق را از نام فایل بخوانید.",
      "dimensions": [
        520,
        160
      ],
      "bytes": 4454,
      "approval_status": "WORKING_DRAFT",
      "license_status": "UNKNOWN",
      "source": "مخزن git آهنگ‌بان؛ منشأ بیرونی/مالکیت جداگانه مستند نشده است.",
      "last_changed_on": null,
      "notes": "تاریخ تغییر از metadata فایل ثبت نشده؛ نسخهٔ موجود را حذف یا جایگزین نکنید.",
      "aspect_ratio": "13:4"
    },
    {
      "path": "assets/ahangban-logo-horizontal-reverse.png",
      "file_name": "ahangban-logo-horizontal-reverse.png",
      "category": "asset",
      "format": "png",
      "purpose": "لوگو، نشان یا آیکن رابط؛ نسخهٔ دقیق را از نام فایل بخوانید.",
      "dimensions": [
        1200,
        369
      ],
      "bytes": 18212,
      "approval_status": "WORKING_DRAFT",
      "license_status": "UNKNOWN",
      "source": "مخزن git آهنگ‌بان؛ منشأ بیرونی/مالکیت جداگانه مستند نشده است.",
      "last_changed_on": null,
      "notes": "تاریخ تغییر از metadata فایل ثبت نشده؛ نسخهٔ موجود را حذف یا جایگزین نکنید.",
      "aspect_ratio": "400:123"
    },
    {
      "path": "assets/ahangban-logo-horizontal-reverse.svg",
      "file_name": "ahangban-logo-horizontal-reverse.svg",
      "category": "asset",
      "format": "svg",
      "purpose": "لوگو، نشان یا آیکن رابط؛ نسخهٔ دقیق را از نام فایل بخوانید.",
      "dimensions": [
        520,
        160
      ],
      "bytes": 4456,
      "approval_status": "WORKING_DRAFT",
      "license_status": "UNKNOWN",
      "source": "مخزن git آهنگ‌بان؛ منشأ بیرونی/مالکیت جداگانه مستند نشده است.",
      "last_changed_on": null,
      "notes": "تاریخ تغییر از metadata فایل ثبت نشده؛ نسخهٔ موجود را حذف یا جایگزین نکنید.",
      "aspect_ratio": "13:4"
    },
    {
      "path": "assets/ahangban-logo-horizontal.png",
      "file_name": "ahangban-logo-horizontal.png",
      "category": "asset",
      "format": "png",
      "purpose": "لوگو، نشان یا آیکن رابط؛ نسخهٔ دقیق را از نام فایل بخوانید.",
      "dimensions": [
        1200,
        369
      ],
      "bytes": 21204,
      "approval_status": "WORKING_DRAFT",
      "license_status": "UNKNOWN",
      "source": "مخزن git آهنگ‌بان؛ منشأ بیرونی/مالکیت جداگانه مستند نشده است.",
      "last_changed_on": null,
      "notes": "تاریخ تغییر از metadata فایل ثبت نشده؛ نسخهٔ موجود را حذف یا جایگزین نکنید.",
      "aspect_ratio": "400:123"
    },
    {
      "path": "assets/ahangban-logo-horizontal.svg",
      "file_name": "ahangban-logo-horizontal.svg",
      "category": "asset",
      "format": "svg",
      "purpose": "لوگو، نشان یا آیکن رابط؛ نسخهٔ دقیق را از نام فایل بخوانید.",
      "dimensions": [
        520,
        160
      ],
      "bytes": 4448,
      "approval_status": "WORKING_DRAFT",
      "license_status": "UNKNOWN",
      "source": "مخزن git آهنگ‌بان؛ منشأ بیرونی/مالکیت جداگانه مستند نشده است.",
      "last_changed_on": null,
      "notes": "تاریخ تغییر از metadata فایل ثبت نشده؛ نسخهٔ موجود را حذف یا جایگزین نکنید.",
      "aspect_ratio": "13:4"
    },
    {
      "path": "assets/ahangban-logo-stacked-color.png",
      "file_name": "ahangban-logo-stacked-color.png",
      "category": "asset",
      "format": "png",
      "purpose": "لوگو، نشان یا آیکن رابط؛ نسخهٔ دقیق را از نام فایل بخوانید.",
      "dimensions": [
        1000,
        1000
      ],
      "bytes": 24917,
      "approval_status": "WORKING_DRAFT",
      "license_status": "UNKNOWN",
      "source": "مخزن git آهنگ‌بان؛ منشأ بیرونی/مالکیت جداگانه مستند نشده است.",
      "last_changed_on": null,
      "notes": "تاریخ تغییر از metadata فایل ثبت نشده؛ نسخهٔ موجود را حذف یا جایگزین نکنید.",
      "aspect_ratio": "1:1"
    },
    {
      "path": "assets/ahangban-logo-stacked-color.svg",
      "file_name": "ahangban-logo-stacked-color.svg",
      "category": "asset",
      "format": "svg",
      "purpose": "لوگو، نشان یا آیکن رابط؛ نسخهٔ دقیق را از نام فایل بخوانید.",
      "dimensions": [
        360,
        360
      ],
      "bytes": 4456,
      "approval_status": "WORKING_DRAFT",
      "license_status": "UNKNOWN",
      "source": "مخزن git آهنگ‌بان؛ منشأ بیرونی/مالکیت جداگانه مستند نشده است.",
      "last_changed_on": null,
      "notes": "تاریخ تغییر از metadata فایل ثبت نشده؛ نسخهٔ موجود را حذف یا جایگزین نکنید.",
      "aspect_ratio": "1:1"
    },
    {
      "path": "assets/ahangban-logo-stacked.png",
      "file_name": "ahangban-logo-stacked.png",
      "category": "asset",
      "format": "png",
      "purpose": "لوگو، نشان یا آیکن رابط؛ نسخهٔ دقیق را از نام فایل بخوانید.",
      "dimensions": [
        1000,
        1000
      ],
      "bytes": 24070,
      "approval_status": "WORKING_DRAFT",
      "license_status": "UNKNOWN",
      "source": "مخزن git آهنگ‌بان؛ منشأ بیرونی/مالکیت جداگانه مستند نشده است.",
      "last_changed_on": null,
      "notes": "تاریخ تغییر از metadata فایل ثبت نشده؛ نسخهٔ موجود را حذف یا جایگزین نکنید.",
      "aspect_ratio": "1:1"
    },
    {
      "path": "assets/ahangban-logo-stacked.svg",
      "file_name": "ahangban-logo-stacked.svg",
      "category": "asset",
      "format": "svg",
      "purpose": "لوگو، نشان یا آیکن رابط؛ نسخهٔ دقیق را از نام فایل بخوانید.",
      "dimensions": [
        360,
        360
      ],
      "bytes": 4450,
      "approval_status": "WORKING_DRAFT",
      "license_status": "UNKNOWN",
      "source": "مخزن git آهنگ‌بان؛ منشأ بیرونی/مالکیت جداگانه مستند نشده است.",
      "last_changed_on": null,
      "notes": "تاریخ تغییر از metadata فایل ثبت نشده؛ نسخهٔ موجود را حذف یا جایگزین نکنید.",
      "aspect_ratio": "1:1"
    },
    {
      "path": "assets/ahangban-mark-color.png",
      "file_name": "ahangban-mark-color.png",
      "category": "asset",
      "format": "png",
      "purpose": "لوگو، نشان یا آیکن رابط؛ نسخهٔ دقیق را از نام فایل بخوانید.",
      "dimensions": [
        600,
        600
      ],
      "bytes": 9277,
      "approval_status": "WORKING_DRAFT",
      "license_status": "UNKNOWN",
      "source": "مخزن git آهنگ‌بان؛ منشأ بیرونی/مالکیت جداگانه مستند نشده است.",
      "last_changed_on": null,
      "notes": "تاریخ تغییر از metadata فایل ثبت نشده؛ نسخهٔ موجود را حذف یا جایگزین نکنید.",
      "aspect_ratio": "1:1"
    },
    {
      "path": "assets/ahangban-mark-color.svg",
      "file_name": "ahangban-mark-color.svg",
      "category": "asset",
      "format": "svg",
      "purpose": "لوگو، نشان یا آیکن رابط؛ نسخهٔ دقیق را از نام فایل بخوانید.",
      "dimensions": [
        120,
        120
      ],
      "bytes": 586,
      "approval_status": "WORKING_DRAFT",
      "license_status": "UNKNOWN",
      "source": "مخزن git آهنگ‌بان؛ منشأ بیرونی/مالکیت جداگانه مستند نشده است.",
      "last_changed_on": null,
      "notes": "تاریخ تغییر از metadata فایل ثبت نشده؛ نسخهٔ موجود را حذف یا جایگزین نکنید.",
      "aspect_ratio": "1:1"
    },
    {
      "path": "assets/ahangban-mark-mono.png",
      "file_name": "ahangban-mark-mono.png",
      "category": "asset",
      "format": "png",
      "purpose": "لوگو، نشان یا آیکن رابط؛ نسخهٔ دقیق را از نام فایل بخوانید.",
      "dimensions": [
        600,
        600
      ],
      "bytes": 9095,
      "approval_status": "WORKING_DRAFT",
      "license_status": "UNKNOWN",
      "source": "مخزن git آهنگ‌بان؛ منشأ بیرونی/مالکیت جداگانه مستند نشده است.",
      "last_changed_on": null,
      "notes": "تاریخ تغییر از metadata فایل ثبت نشده؛ نسخهٔ موجود را حذف یا جایگزین نکنید.",
      "aspect_ratio": "1:1"
    },
    {
      "path": "assets/ahangban-mark-mono.svg",
      "file_name": "ahangban-mark-mono.svg",
      "category": "asset",
      "format": "svg",
      "purpose": "لوگو، نشان یا آیکن رابط؛ نسخهٔ دقیق را از نام فایل بخوانید.",
      "dimensions": [
        120,
        120
      ],
      "bytes": 598,
      "approval_status": "WORKING_DRAFT",
      "license_status": "UNKNOWN",
      "source": "مخزن git آهنگ‌بان؛ منشأ بیرونی/مالکیت جداگانه مستند نشده است.",
      "last_changed_on": null,
      "notes": "تاریخ تغییر از metadata فایل ثبت نشده؛ نسخهٔ موجود را حذف یا جایگزین نکنید.",
      "aspect_ratio": "1:1"
    },
    {
      "path": "assets/ahangban-mark.svg",
      "file_name": "ahangban-mark.svg",
      "category": "asset",
      "format": "svg",
      "purpose": "لوگو، نشان یا آیکن رابط؛ نسخهٔ دقیق را از نام فایل بخوانید.",
      "dimensions": [
        120,
        120
      ],
      "bytes": 599,
      "approval_status": "WORKING_DRAFT",
      "license_status": "UNKNOWN",
      "source": "مخزن git آهنگ‌بان؛ منشأ بیرونی/مالکیت جداگانه مستند نشده است.",
      "last_changed_on": null,
      "notes": "تاریخ تغییر از metadata فایل ثبت نشده؛ نسخهٔ موجود را حذف یا جایگزین نکنید.",
      "aspect_ratio": "1:1"
    },
    {
      "path": "assets/ahangban-wordmark-custom-color.png",
      "file_name": "ahangban-wordmark-custom-color.png",
      "category": "asset",
      "format": "png",
      "purpose": "لوگو، نشان یا آیکن رابط؛ نسخهٔ دقیق را از نام فایل بخوانید.",
      "dimensions": [
        900,
        397